COMP TUTORIAL LEVEL 5,SMYEAR,,,M22732,COMP TUTORIAL LEVEL 5,Core,0,FHEQ 5,COMP,Matthew Dennis,Approved,
PROGRAMMING APPLICATIONS AND PROGRAMMING LANGUAGES,SMYEAR,,,M30235,PROGRAMMING APPLICATIONS AND PROGRAMMING LANGUAGES,Core,20,FHEQ 5,COMP,Jiacheng Tan,Approved,
SOFTWARE ENGINEERING THEORY AND PRACTICE,SMYEAR,,,M30819,SOFTWARE ENGINEERING THEORY AND PRACTICE,Core,20,FHEQ 5,COMP,Claudia Iacob,Approved,
DATA STRUCTURES AND ALGORITHMS,SMSEP,,,M21270,DATA STRUCTURES AND ALGORITHMS,Core,20,FHEQ 5,COMP,Dalin Zhou,Approved,
OPERATING SYSTEMS AND INTERNETWORKING,SMSEP,,,M30233,OPERATING SYSTEMS AND INTERNETWORKING,Core,20,FHEQ 5,COMP,Tamer Elboghdadly,Approved,
DISCRETE MATHEMATICS AND FUNCTIONAL PROGRAMMING,SMJAN,,,M21274,DISCRETE MATHEMATICS AND FUNCTIONAL PROGRAMMING,Core,20,FHEQ 5,COMP,Janka Chlebikova,Approved,